{
  "article_id": "BLOG_04",
  "gate": "TECHNICAL_REVIEW_GATE",
  "verdict": "PASS",
  "audited_at": "2026-09-28T21:15:00+07:00",
  "auditor": "review_agent",
  "summary": "Technical Re-Review after Revision Loop 2 completed with independent adversarial re-audit. Verified all 9 issues resolved (REV-001 to REV-009). Full prose re-audit confirmed 0 mid-sentence citations (ADR-013 Gate 5 PASS), 0 citation scope overextensions, strictly monotonic IEEE first appearance order [1] -> [2] -> [3] -> [4] -> [5] -> [6], 100% numerical claim and formula verification, and valid 17-claim mapping. Verdict: PASS.",
  "checks": [
    {
      "check_id": "CHK-001",
      "name": "Research Package Consistency & Preconditions",
      "result": "PASS",
      "details": "Preconditions verified: 7/7 RQs answered, 17 approved EVDs intact, no research conflicts."
    },
    {
      "check_id": "CHK-002",
      "name": "Claim-to-Evidence Traceability",
      "result": "PASS",
      "details": "All 17 claims in claim_source_map.json trace to verified EVDs and sources. CLM-011 and CLM-013 wording synchronized."
    },
    {
      "check_id": "CHK-003",
      "name": "Full Prose Evidence Boundary",
      "result": "PASS",
      "details": "Executive Summary line 5 reframed to structural orientation without overextension. All prose statements trace to approved evidence."
    },
    {
      "check_id": "CHK-004",
      "name": "Numerical Claim Verification",
      "result": "PASS",
      "details": "All numbers trace to approved EVDs. Unapproved TDD percentages (8-20%) and 5-30s duration verified removed."
    },
    {
      "check_id": "CHK-005",
      "name": "Formula & SI Dimensional Analysis",
      "result": "PASS",
      "details": "Starting torque Eq (1) and THDi Eq (2) are dimensionally consistent with defined SI units and KaTeX syntax."
    },
    {
      "check_id": "CHK-006",
      "name": "IEEE In-Text Citation Placement (ADR-013 Gate 5)",
      "result": "PASS",
      "details": "Section 3.1 line 48 compound sentence split with citation [1, p. 16] at sentence end. Global scan confirmed 0 mid-sentence citations."
    },
    {
      "check_id": "CHK-007",
      "name": "IEEE Citation Numbering & Appearance Order",
      "result": "PASS",
      "details": "First appearance order strictly monotonic: [1] (Line 5) -> [2] (Line 46) -> [3] (Line 79) -> [4] (Line 116) -> [5] (Line 138) -> [6] (Line 176)."
    },
    {
      "check_id": "CHK-008",
      "name": "Locator Verification",
      "result": "PASS",
      "details": "All citations point to verified locators in evidence.json."
    },
    {
      "check_id": "CHK-009",
      "name": "Source Policy & Quality (ADR-024)",
      "result": "PASS",
      "details": "6 accepted sources (5 Tier 1, 1 Tier 3 supplementary), high-tier ratio 83.3% >= 70%."
    },
    {
      "check_id": "CHK-010",
      "name": "Canonical Blog Taxonomy (BLOG-T04 Comparison)",
      "result": "PASS",
      "details": "Comparison logic, trade-off balance, and conditional decision framework verified."
    }
  ],
  "revision_request_file": null
}
